{
    "readonly": false,
    "description": "Match with 10 second exposure time and 10 series",
    "series": [
        {
            "optional": false,
            "name": "10s Series 1",
            "events": [
                {
                    "duration": 60000,
                    "audio_ids": [
                        1
                    ],
                    "command": "show"
                },
                {
                    "command": "hide",
                    "duration": 7000
                },
                {
                    "command": "show",
                    "duration": 10000
                },
                {
                    "command": "hide",
                    "duration": 1000
                },
                {
                    "audio_ids": [
                        1
                    ],
                    "duration": 3000
                },
                {
                    "command": "show",
                    "duration": 1000
                }
            ]
        },
        {
            "optional": false,
            "name": "10s Series 2",
            "events": [
                {
                    "duration": 60000,
                    "audio_ids": [
                        1
                    ],
                    "command": "show"
                },
                {
                    "command": "hide",
                    "duration": 7000
                },
                {
                    "command": "show",
                    "duration": 10000
                },
                {
                    "command": "hide",
                    "duration": 1000
                },
                {
                    "audio_ids": [
                        1
                    ],
                    "duration": 3000
                },
                {
                    "command": "show",
                    "duration": 1000
                }
            ]
        },
        {
            "optional": false,
            "name": "10s Series 3",
            "events": [
                {
                    "duration": 60000,
                    "audio_ids": [
                        1
                    ],
                    "command": "show"
                },
                {
                    "command": "hide",
                    "duration": 7000
                },
                {
                    "command": "show",
                    "duration": 10000
                },
                {
                    "command": "hide",
                    "duration": 1000
                },
                {
                    "audio_ids": [
                        1
                    ],
                    "duration": 3000
                },
                {
                    "command": "show",
                    "duration": 1000
                }
            ]
        },
        {
            "optional": false,
            "name": "10s Series 4",
            "events": [
                {
                    "duration": 60000,
                    "audio_ids": [
                        1
                    ],
                    "command": "show"
                },
                {
                    "command": "hide",
                    "duration": 7000
                },
                {
                    "command": "show",
                    "duration": 10000
                },
                {
                    "command": "hide",
                    "duration": 1000
                },
                {
                    "audio_ids": [
                        1
                    ],
                    "duration": 3000
                },
                {
                    "command": "show",
                    "duration": 1000
                }
            ]
        },
        {
            "optional": true,
            "name": "10s Series 5",
            "events": [
                {
                    "duration": 60000,
                    "audio_ids": [
                        1
                    ],
                    "command": "show"
                },
                {
                    "command": "hide",
                    "duration": 7000
                },
                {
                    "command": "show",
                    "duration": 10000
                },
                {
                    "command": "hide",
                    "duration": 1000
                },
                {
                    "audio_ids": [
                        1
                    ],
                    "duration": 3000
                },
                {
                    "command": "show",
                    "duration": 1000
                }
            ]
        },
        {
            "optional": true,
            "name": "10s Series 6",
            "events": [
                {
                    "duration": 60000,
                    "audio_ids": [
                        1
                    ],
                    "command": "show"
                },
                {
                    "command": "hide",
                    "duration": 7000
                },
                {
                    "command": "show",
                    "duration": 10000
                },
                {
                    "command": "hide",
                    "duration": 1000
                },
                {
                    "audio_ids": [
                        1
                    ],
                    "duration": 3000
                },
                {
                    "command": "show",
                    "duration": 1000
                }
            ]
        },
        {
            "optional": true,
            "name": "10s Series 7",
            "events": [
                {
                    "duration": 60000,
                    "audio_ids": [
                        1
                    ],
                    "command": "show"
                },
                {
                    "command": "hide",
                    "duration": 7000
                },
                {
                    "command": "show",
                    "duration": 10000
                },
                {
                    "command": "hide",
                    "duration": 1000
                },
                {
                    "audio_ids": [
                        1
                    ],
                    "duration": 3000
                },
                {
                    "command": "show",
                    "duration": 1000
                }
            ]
        },
        {
            "optional": true,
            "name": "10s Series 8",
            "events": [
                {
                    "duration": 60000,
                    "audio_ids": [
                        1
                    ],
                    "command": "show"
                },
                {
                    "command": "hide",
                    "duration": 7000
                },
                {
                    "command": "show",
                    "duration": 10000
                },
                {
                    "command": "hide",
                    "duration": 1000
                },
                {
                    "audio_ids": [
                        1
                    ],
                    "duration": 3000
                },
                {
                    "command": "show",
                    "duration": 1000
                }
            ]
        },
        {
            "optional": true,
            "name": "10s Series 9",
            "events": [
                {
                    "duration": 60000,
                    "audio_ids": [
                        1
                    ],
                    "command": "show"
                },
                {
                    "command": "hide",
                    "duration": 7000
                },
                {
                    "command": "show",
                    "duration": 10000
                },
                {
                    "command": "hide",
                    "duration": 1000
                },
                {
                    "audio_ids": [
                        1
                    ],
                    "duration": 3000
                },
                {
                    "command": "show",
                    "duration": 1000
                }
            ]
        },
        {
            "optional": true,
            "name": "10s Series 10",
            "events": [
                {
                    "duration": 60000,
                    "audio_ids": [
                        1
                    ],
                    "command": "show"
                },
                {
                    "command": "hide",
                    "duration": 7000
                },
                {
                    "command": "show",
                    "duration": 10000
                },
                {
                    "command": "hide",
                    "duration": 1000
                },
                {
                    "audio_ids": [
                        1
                    ],
                    "duration": 3000
                },
                {
                    "command": "show",
                    "duration": 1000
                }
            ]
        }
    ],
    "id": 102,
    "title": "Militär Snabbmatch 10s"
}