{
  "id": 40,
  "title": "Fältträning",
  "description": "Each series starts hidden for 10s, then 3x show/hide cycles",
  "readonly": false,
  "series": [
    {
      "events": [
        {
          "command": "hide",
          "duration": 10000,
          "audio_ids": [
            31
          ]
        },
        {
          "command": "show",
          "duration": 3000
        },
        {
          "command": "hide",
          "duration": 3000
        },
        {
          "command": "show",
          "duration": 3000
        },
        {
          "command": "hide",
          "duration": 3000
        },
        {
          "command": "show",
          "duration": 3000
        },
        {
          "command": "hide",
          "duration": 3000
        }
      ],
      "name": "Series 1 (show=3, hide=3)",
      "optional": false
    },
    {
      "events": [
        {
          "command": "hide",
          "duration": 10000,
          "audio_ids": [
            31
          ]
        },
        {
          "command": "show",
          "duration": 2000
        },
        {
          "command": "hide",
          "duration": 3000
        },
        {
          "command": "show",
          "duration": 2000
        },
        {
          "command": "hide",
          "duration": 3000
        },
        {
          "command": "show",
          "duration": 2000
        },
        {
          "command": "hide",
          "duration": 3000
        }
      ],
      "name": "Series 2 (show=2, hide=3)",
      "optional": false
    }
  ]
}